{
  "dataset_id": "dev-xlsx-regions-002",
  "insights": [
    {
      "kind": "causal_limit",
      "message": "The file cannot explain the cause of differences in screening coverage."
    }
  ],
  "interpretation_guard": {
    "can_explain_cause": false,
    "caveat": "The data set does not contain explanatory variables or contextual information to determine why coverage varies."
  },
  "question": "What is the nutrition screening coverage by block for the selected year?",
  "schema_version": 1,
  "steps": [
    {
      "op": "limit",
      "rows": 6
    }
  ],
  "view": {
    "chart": "line",
    "note": "Source: sheet Quarterly Review, tables Table 1; Table 2, range Quarterly Review!A1:C7; Quarterly Review!E1:G7",
    "series": "block",
    "title": "Nutrition screening coverage by block and year",
    "unit": "percent",
    "x": "year",
    "y": [
      "screening_coverage_percent"
    ]
  }
}
