{
  "schema_version": 1,
  "dataset_id": "dev-xlsx-headers-001",
  "question": "Show primary and secondary school attendance by block, year and sex, with selectable indicator and year, and display source sheet and table.",
  "steps": [
    {
      "op": "filter",
      "column": "primary_boys_attendance_percent",
      "cmp": "ne",
      "value": null
    },
    {
      "op": "filter",
      "column": "primary_girls_attendance_percent",
      "cmp": "ne",
      "value": null
    },
    {
      "op": "filter",
      "column": "secondary_boys_attendance_percent",
      "cmp": "ne",
      "value": null
    },
    {
      "op": "filter",
      "column": "secondary_girls_attendance_percent",
      "cmp": "ne",
      "value": null
    }
  ],
  "insights": [],
  "view": {
    "title": "School Attendance by Block, Year and Sex",
    "chart": "grouped_bar",
    "x": "year",
    "y": [
      "primary_boys_attendance_percent",
      "primary_girls_attendance_percent",
      "secondary_boys_attendance_percent",
      "secondary_girls_attendance_percent"
    ],
    "series": "block",
    "unit": "percent",
    "note": "Data sourced from Attendance Report!A1:E7; Table 1 and Attendance Report!A11:E17; Table 2 in school_attendance_nested.xlsx. The table provides reported attendance percentages for primary and secondary boys and girls by block and year. No further analysis of causes is available in this file."
  },
  "interpretation_guard": {
    "can_explain_cause": false,
    "caveat": "The dataset does not provide explanatory variables or intervention data."
  }
}
