{
  "schema_version": 1,
  "dataset_id": "dev-csv-health-001",
  "question": "What is the 4‑antenatal‑checkup coverage by district for the years 2021 to 2023, and what is the change in coverage from 2021 to 2023 for Gaya and Nalanda?",
  "steps": [
    {
      "op": "filter",
      "column": "year",
      "cmp": "in",
      "value": [
        2021,
        2022,
        2023
      ]
    },
    {
      "op": "derive",
      "name": "coverage_percent",
      "kind": "percent",
      "numerator": "anc4_completed",
      "denominator": "pregnancies_registered",
      "unit": "percent"
    }
  ],
  "insights": [
    {
      "kind": "change",
      "metric": "coverage_percent",
      "entity_column": "district",
      "entities": [
        "Gaya",
        "Nalanda"
      ],
      "time_column": "year",
      "from": 2021,
      "to": 2023,
      "unit": "percentage points"
    }
  ],
  "view": {
    "title": "ANC4 Coverage by District (2021‑2023)",
    "chart": "grouped_bar",
    "x": "year",
    "y": [
      "coverage_percent"
    ],
    "series": "district",
    "unit": "percent",
    "note": "Select a year to see coverage by district. The bars represent the percentage of pregnancies that completed at least 4 antenatal check‑ups. Source: synthetic Bihar ANC fixture – see the source tab for details."
  },
  "interpretation_guard": {
    "can_explain_cause": false,
    "caveat": "The data are synthetic and may not reflect real‑world conditions."
  }
}
