{
  "schema_version": 1,
  "dataset_id": "dev-csv-health-001",
  "question": "Why is Gaya's ANC4 coverage below Nalanda's?",
  "clarification": null,
  "steps": [
    {
      "op": "filter",
      "column": "year",
      "cmp": "between",
      "value": [
        2021,
        2023
      ]
    },
    {
      "op": "filter",
      "column": "district",
      "cmp": "in",
      "value": [
        "Gaya",
        "Nalanda"
      ]
    },
    {
      "op": "derive",
      "name": "anc4_coverage_percent",
      "kind": "percent",
      "numerator": "anc4_completed",
      "denominator": "pregnancies_registered",
      "unit": "percent"
    }
  ],
  "insights": [
    {
      "kind": "change",
      "metric": "anc4_coverage_percent",
      "entity_column": "district",
      "entities": [
        "Gaya",
        "Nalanda"
      ],
      "time_column": "year",
      "from": 2021,
      "to": 2023,
      "unit": "percentage points"
    },
    {
      "kind": "causal_limit",
      "message": "This file contains only counts of registered pregnancies and completed checkups by district and year. It has no information on facility access, staffing, transport, community awareness, or any other factor that could explain why one district outperforms another. The data can show that a gap exists and how large it is, but it cannot explain the cause."
    }
  ],
  "view": {
    "title": "ANC4 Coverage: Gaya vs Nalanda, 2021–2023",
    "chart": "line",
    "x": "year",
    "y": [
      "anc4_coverage_percent"
    ],
    "series": "district",
    "unit": "percent",
    "note": "Each line shows the share of registered pregnancies that completed four antenatal checkups. The chart shows the gap between the two districts over time, but it cannot tell us why the gap exists."
  },
  "interpretation_guard": {
    "can_explain_cause": false,
    "caveat": "This file contains only counts of registered pregnancies and completed checkups by district and year. It has no information on facility access, staffing, transport, community awareness, or any other factor that could explain why one district outperforms another. The data can show that a gap exists and how large it is, but it cannot explain the cause. Any explanation would require additional data or context not present in this file."
  }
}
