{
  "schema_version": 1,
  "dataset_id": "smoke-001",
  "question": "Which district has the lowest full immunisation coverage in 2023?",
  "steps": [
    {
      "op": "filter",
      "column": "year",
      "cmp": "eq",
      "value": 2023
    },
    {
      "op": "derive",
      "name": "coverage_percent",
      "kind": "percent",
      "numerator": "children_fully_immunised",
      "denominator": "children_due",
      "unit": "percent"
    }
  ],
  "insights": [],
  "view": {
    "title": "District Immunisation Coverage – 2023",
    "chart": "line",
    "x": "year",
    "y": [
      "coverage_percent"
    ],
    "series": "district",
    "unit": "percent",
    "note": "Each bar shows the share of children fully immunised in that district for 2023. The shortest bar is the district with the lowest coverage."
  },
  "interpretation_guard": {
    "can_explain_cause": false,
    "caveat": "The data shows coverage levels but does not include information about why districts differ."
  }
}
