{
  "schema_version": 1,
  "dataset_id": "dev-csv-health-001",
  "question": "What is the ANC4 coverage for Gaya and Nalanda in 2021, 2022, and 2023, and what is the change in percentage points between 2021 and 2023?",
  "steps": [
    {
      "op": "filter",
      "column": "year",
      "cmp": "in",
      "value": [
        2021,
        2022,
        2023
      ]
    },
    {
      "op": "filter",
      "column": "district",
      "cmp": "in",
      "value": [
        "Gaya",
        "Nalanda"
      ]
    },
    {
      "op": "derive",
      "name": "anc4_coverage",
      "kind": "percent",
      "numerator": "anc4_completed",
      "denominator": "pregnancies_registered",
      "unit": "percent"
    }
  ],
  "insights": [
    {
      "kind": "change",
      "metric": "anc4_coverage",
      "entity_column": "district",
      "entities": [
        "Gaya",
        "Nalanda"
      ],
      "time_column": "year",
      "from": 2021,
      "to": 2023,
      "unit": "percentage points"
    },
    {
      "kind": "causal_limit",
      "message": "The data do not provide information on factors that could explain why Gaya's coverage is below Nalanda's."
    }
  ],
  "view": {
    "title": "ANC4 Coverage for Gaya and Nalanda (2021‑2023)",
    "chart": "grouped_bar",
    "x": "year",
    "y": [
      "anc4_coverage"
    ],
    "series": "district",
    "unit": "percent",
    "note": "ANC4 coverage is the percentage of registered pregnancies that completed at least four antenatal check‑ups. It is calculated as (anc4_completed / pregnancies_registered) × 100. The data are synthetic and may not reflect real‑world values."
  },
  "interpretation_guard": {
    "can_explain_cause": false,
    "caveat": "The data are synthetic and may not reflect real‑world values."
  }
}
