{
  "schema_version": 1,
  "dataset_id": "smoke-001",
  "question": "one csv is there. make a simple website showing district immunisation by year. i should select year and compare districts. show the source also",
  "steps": [
    {
      "op": "derive",
      "name": "coverage_percent",
      "kind": "percent",
      "numerator": "children_fully_immunised",
      "denominator": "children_due",
      "unit": "percent"
    }
  ],
  "insights": [],
  "view": {
    "title": "District Immunisation Coverage",
    "chart": "line",
    "x": "year",
    "y": [
      "coverage_percent"
    ],
    "series": "district",
    "unit": "percent",
    "note": "Select a year in the filter to compare districts; the line shows trend across years per district."
  },
  "interpretation_guard": {
    "can_explain_cause": false,
    "caveat": "Synthetic smoke fixture; no causal claims can be made."
  }
}
